{
  "version": "1.0.0",
  "pageId": "p12_rot_perspective",
  "source": {
    "path": "/Users/jonathanbotha/GitHub/Asteria-Studio/tests/fixtures/golden_corpus/v1/inputs/p12_rot_perspective.png",
    "checksum": "345d449426cd30e803e51fb2e7a4dce849c7b644b7c9431c17f63c0de858bc77"
  },
  "dimensions": {
    "width": 767.2916666666666,
    "height": 1084.7916666666667,
    "unit": "mm"
  },
  "dpi": 72,
  "normalization": {
    "cropBox": [
      0,
      0,
      2174,
      3074
    ],
    "pageMask": [
      26,
      30,
      2145,
      3040
    ],
    "dpiSource": "metadata",
    "bleed": 12.499975,
    "trim": 0,
    "scale": 0.74435318275154,
    "skewAngle": -16,
    "warp": {
      "method": "affine",
      "residual": 0
    },
    "shadow": {
      "present": false,
      "side": "none",
      "widthPx": 0,
      "confidence": -0.41521107221839043,
      "darkness": -74.7480883713036
    },
    "shading": {
      "method": "border-regression",
      "backgroundModel": "lowpass-field",
      "spineShadowModel": "edge-aware-band",
      "params": {
        "fieldWidth": 96,
        "fieldHeight": 96
      },
      "confidence": 0
    }
  },
  "elements": [
    {
      "id": "p12_rot_perspective-page-bounds",
      "type": "page_bounds",
      "bbox": [
        0,
        0,
        2174,
        3074
      ],
      "confidence": 0.6,
      "source": "local",
      "flags": [
        "derived"
      ]
    },
    {
      "id": "p12_rot_perspective-text-block",
      "type": "text_block",
      "bbox": [
        26,
        30,
        2145,
        3040
      ],
      "confidence": 0.55,
      "source": "local",
      "flags": [
        "mask-derived"
      ]
    },
    {
      "id": "p12_rot_perspective-title",
      "type": "title",
      "bbox": [
        280,
        90,
        1891,
        451
      ],
      "confidence": 0.28,
      "source": "local",
      "flags": [
        "heuristic"
      ]
    },
    {
      "id": "p12_rot_perspective-running-head",
      "type": "running_head",
      "bbox": [
        238,
        30,
        1933,
        271
      ],
      "confidence": 0.25,
      "source": "local",
      "flags": [
        "heuristic"
      ]
    },
    {
      "id": "p12_rot_perspective-folio",
      "type": "folio",
      "bbox": [
        916,
        2739,
        1255,
        2980
      ],
      "confidence": 0.22,
      "source": "local",
      "flags": [
        "heuristic"
      ]
    },
    {
      "id": "p12_rot_perspective-ornament",
      "type": "ornament",
      "bbox": [
        916,
        572,
        1255,
        752
      ],
      "confidence": 0.2,
      "source": "local",
      "flags": [
        "heuristic"
      ]
    },
    {
      "id": "p12_rot_perspective-drop-cap",
      "type": "drop_cap",
      "bbox": [
        68,
        572,
        238,
        993
      ],
      "confidence": 0.18,
      "source": "local",
      "flags": [
        "heuristic"
      ]
    },
    {
      "id": "p12_rot_perspective-footnote",
      "type": "footnote",
      "bbox": [
        132,
        2619,
        2039,
        2980
      ],
      "confidence": 0.2,
      "source": "local",
      "flags": [
        "heuristic"
      ]
    },
    {
      "id": "p12_rot_perspective-marginalia",
      "type": "marginalia",
      "bbox": [
        26,
        783,
        196,
        2288
      ],
      "confidence": 0.18,
      "source": "local",
      "flags": [
        "heuristic"
      ]
    }
  ],
  "metrics": {
    "processingMs": 0,
    "deskewConfidence": 1,
    "shadowScore": -74.7480883713036,
    "maskCoverage": 0.9945541184479237,
    "backgroundStd": 2.0998306560070406,
    "backgroundMean": 254.55684535469294,
    "illuminationResidual": 0.5962956484699746,
    "spineShadowScore": 0,
    "layoutScore": 0.969889301348576,
    "baseline": {
      "medianSpacingPx": 23.859060402684563,
      "lineStraightnessResidual": 8,
      "confidence": 0.721021830722946
    }
  },
  "overrides": {}
}
