{
  "version": "1.0.0",
  "pageId": "p06_blank_verso",
  "source": {
    "path": "/Users/jonathanbotha/GitHub/Asteria-Studio/tests/fixtures/golden_corpus/v1/inputs/p06_blank_verso.png",
    "checksum": "293ec5bbc098e00b57ef7b6c96c456ca8c2930b1e2bef4b2bc272c79453377e8"
  },
  "dimensions": {
    "width": 767.2916666666666,
    "height": 1084.7916666666667,
    "unit": "mm"
  },
  "dpi": 72,
  "normalization": {
    "cropBox": [
      0,
      0,
      2174,
      3074
    ],
    "pageMask": [
      1,
      1,
      2173,
      3073
    ],
    "dpiSource": "metadata",
    "bleed": 12.499975,
    "trim": 0,
    "scale": 0.9645232815964523,
    "skewAngle": 1.5088401624590002,
    "warp": {
      "method": "affine",
      "residual": 0
    },
    "shadow": {
      "present": false,
      "side": "none",
      "widthPx": 0,
      "confidence": -0.012353887472606602,
      "darkness": -3.061482135625056
    },
    "shading": {
      "method": "border-regression",
      "backgroundModel": "lowpass-field",
      "spineShadowModel": "edge-aware-band",
      "params": {
        "fieldWidth": 96,
        "fieldHeight": 96
      },
      "confidence": 0.04567613938458769
    }
  },
  "elements": [
    {
      "id": "p06_blank_verso-page-bounds",
      "type": "page_bounds",
      "bbox": [
        0,
        0,
        2174,
        3074
      ],
      "confidence": 0.6,
      "source": "local",
      "flags": [
        "derived"
      ]
    },
    {
      "id": "p06_blank_verso-text-block",
      "type": "text_block",
      "bbox": [
        1,
        1,
        2173,
        3073
      ],
      "confidence": 0.55,
      "source": "local",
      "flags": [
        "mask-derived"
      ]
    },
    {
      "id": "p06_blank_verso-title",
      "type": "title",
      "bbox": [
        262,
        62,
        1912,
        431
      ],
      "confidence": 0.28,
      "source": "local",
      "flags": [
        "heuristic"
      ]
    },
    {
      "id": "p06_blank_verso-running-head",
      "type": "running_head",
      "bbox": [
        218,
        1,
        1956,
        247
      ],
      "confidence": 0.25,
      "source": "local",
      "flags": [
        "heuristic"
      ]
    },
    {
      "id": "p06_blank_verso-folio",
      "type": "folio",
      "bbox": [
        913,
        2766,
        1261,
        3012
      ],
      "confidence": 0.22,
      "source": "local",
      "flags": [
        "heuristic"
      ]
    },
    {
      "id": "p06_blank_verso-ornament",
      "type": "ornament",
      "bbox": [
        913,
        554,
        1261,
        738
      ],
      "confidence": 0.2,
      "source": "local",
      "flags": [
        "heuristic"
      ]
    },
    {
      "id": "p06_blank_verso-drop-cap",
      "type": "drop_cap",
      "bbox": [
        44,
        554,
        218,
        984
      ],
      "confidence": 0.18,
      "source": "local",
      "flags": [
        "heuristic"
      ]
    },
    {
      "id": "p06_blank_verso-footnote",
      "type": "footnote",
      "bbox": [
        110,
        2643,
        2064,
        3012
      ],
      "confidence": 0.2,
      "source": "local",
      "flags": [
        "heuristic"
      ]
    },
    {
      "id": "p06_blank_verso-marginalia",
      "type": "marginalia",
      "bbox": [
        1,
        769,
        175,
        2305
      ],
      "confidence": 0.18,
      "source": "local",
      "flags": [
        "heuristic"
      ]
    }
  ],
  "metrics": {
    "processingMs": 0,
    "deskewConfidence": 0.2534008672307042,
    "shadowScore": -3.061482135625056,
    "maskCoverage": 1,
    "backgroundStd": 3.567446112180274,
    "backgroundMean": 249.83591788433833,
    "illuminationResidual": 0.6255916780803682,
    "spineShadowScore": 0,
    "layoutScore": 0.6362585066888071,
    "baseline": {
      "lineStraightnessResidual": 0.2008093257552095,
      "confidence": 0.9446823203738983
    }
  },
  "overrides": {}
}
