{
  "version": "1.0.0",
  "pageId": "p02_clean_double",
  "source": {
    "path": "/Users/jonathanbotha/GitHub/Asteria-Studio/tests/fixtures/golden_corpus/v1/inputs/p02_clean_double.png",
    "checksum": "f0d3c80e4b9279de25eef320c45f331cc5c1596cafaa1a9a45a8023004c103d9"
  },
  "dimensions": {
    "width": 767.2916666666666,
    "height": 1084.7916666666667,
    "unit": "mm"
  },
  "dpi": 72,
  "normalization": {
    "cropBox": [
      0,
      0,
      2174,
      3074
    ],
    "pageMask": [
      6,
      5,
      2170,
      3069
    ],
    "dpiSource": "metadata",
    "bleed": 12.499975,
    "trim": 0,
    "scale": 0.7402995234853642,
    "skewAngle": 16,
    "warp": {
      "method": "affine",
      "residual": 0
    },
    "shadow": {
      "present": false,
      "side": "none",
      "widthPx": 0,
      "confidence": -0.4150848667810271,
      "darkness": -74.60446499421215
    },
    "shading": {
      "method": "border-regression",
      "backgroundModel": "lowpass-field",
      "spineShadowModel": "edge-aware-band",
      "params": {
        "fieldWidth": 96,
        "fieldHeight": 96
      },
      "confidence": 0
    }
  },
  "elements": [
    {
      "id": "p02_clean_double-page-bounds",
      "type": "page_bounds",
      "bbox": [
        0,
        0,
        2174,
        3074
      ],
      "confidence": 0.6,
      "source": "local",
      "flags": [
        "derived"
      ]
    },
    {
      "id": "p02_clean_double-text-block",
      "type": "text_block",
      "bbox": [
        6,
        5,
        2170,
        3069
      ],
      "confidence": 0.55,
      "source": "local",
      "flags": [
        "mask-derived"
      ]
    },
    {
      "id": "p02_clean_double-title",
      "type": "title",
      "bbox": [
        266,
        66,
        1910,
        434
      ],
      "confidence": 0.28,
      "source": "local",
      "flags": [
        "heuristic"
      ]
    },
    {
      "id": "p02_clean_double-running-head",
      "type": "running_head",
      "bbox": [
        222,
        5,
        1954,
        250
      ],
      "confidence": 0.25,
      "source": "local",
      "flags": [
        "heuristic"
      ]
    },
    {
      "id": "p02_clean_double-folio",
      "type": "folio",
      "bbox": [
        915,
        2763,
        1261,
        3008
      ],
      "confidence": 0.22,
      "source": "local",
      "flags": [
        "heuristic"
      ]
    },
    {
      "id": "p02_clean_double-ornament",
      "type": "ornament",
      "bbox": [
        915,
        557,
        1261,
        740
      ],
      "confidence": 0.2,
      "source": "local",
      "flags": [
        "heuristic"
      ]
    },
    {
      "id": "p02_clean_double-drop-cap",
      "type": "drop_cap",
      "bbox": [
        49,
        557,
        222,
        985
      ],
      "confidence": 0.18,
      "source": "local",
      "flags": [
        "heuristic"
      ]
    },
    {
      "id": "p02_clean_double-footnote",
      "type": "footnote",
      "bbox": [
        114,
        2640,
        2062,
        3008
      ],
      "confidence": 0.2,
      "source": "local",
      "flags": [
        "heuristic"
      ]
    },
    {
      "id": "p02_clean_double-marginalia",
      "type": "marginalia",
      "bbox": [
        6,
        771,
        179,
        2303
      ],
      "confidence": 0.18,
      "source": "local",
      "flags": [
        "heuristic"
      ]
    }
  ],
  "metrics": {
    "processingMs": 0,
    "deskewConfidence": 1,
    "shadowScore": -74.60446499421215,
    "maskCoverage": 1,
    "backgroundStd": 2.985771837164511,
    "backgroundMean": 254.06466755116307,
    "illuminationResidual": 0.5874591553572596,
    "spineShadowScore": 0,
    "layoutScore": 0.9708205033415949,
    "baseline": {
      "medianSpacingPx": 28.669354838709676,
      "lineStraightnessResidual": 8,
      "confidence": 0.7429759884423033
    }
  },
  "overrides": {}
}
