{
  "version": "1.0.0",
  "pageId": "p11_curved_warp",
  "source": {
    "path": "/Users/jonathanbotha/GitHub/Asteria-Studio/tests/fixtures/golden_corpus/v1/inputs/p11_curved_warp.png",
    "checksum": "4d32952e69eee76581f5f904f0943088a168325a3f7a04d4b419767f967f8748"
  },
  "dimensions": {
    "width": 767.2916666666666,
    "height": 1084.7916666666667,
    "unit": "mm"
  },
  "dpi": 72,
  "normalization": {
    "cropBox": [
      0,
      0,
      2174,
      3074
    ],
    "pageMask": [
      6,
      5,
      2170,
      3069
    ],
    "dpiSource": "metadata",
    "bleed": 12.499975,
    "trim": 0,
    "scale": 0.7402995234853642,
    "skewAngle": 16,
    "warp": {
      "method": "affine",
      "residual": 0
    },
    "shadow": {
      "present": false,
      "side": "none",
      "widthPx": 0,
      "confidence": -0.4479118733026458,
      "darkness": -78.683129264504
    },
    "shading": {
      "method": "border-regression",
      "backgroundModel": "lowpass-field",
      "spineShadowModel": "edge-aware-band",
      "params": {
        "fieldWidth": 96,
        "fieldHeight": 96
      },
      "confidence": 0
    }
  },
  "elements": [
    {
      "id": "p11_curved_warp-page-bounds",
      "type": "page_bounds",
      "bbox": [
        0,
        0,
        2174,
        3074
      ],
      "confidence": 0.6,
      "source": "local",
      "flags": [
        "derived"
      ]
    },
    {
      "id": "p11_curved_warp-text-block",
      "type": "text_block",
      "bbox": [
        6,
        5,
        2170,
        3069
      ],
      "confidence": 0.55,
      "source": "local",
      "flags": [
        "mask-derived"
      ]
    },
    {
      "id": "p11_curved_warp-title",
      "type": "title",
      "bbox": [
        266,
        66,
        1910,
        434
      ],
      "confidence": 0.28,
      "source": "local",
      "flags": [
        "heuristic"
      ]
    },
    {
      "id": "p11_curved_warp-running-head",
      "type": "running_head",
      "bbox": [
        222,
        5,
        1954,
        250
      ],
      "confidence": 0.25,
      "source": "local",
      "flags": [
        "heuristic"
      ]
    },
    {
      "id": "p11_curved_warp-folio",
      "type": "folio",
      "bbox": [
        915,
        2763,
        1261,
        3008
      ],
      "confidence": 0.22,
      "source": "local",
      "flags": [
        "heuristic"
      ]
    },
    {
      "id": "p11_curved_warp-ornament",
      "type": "ornament",
      "bbox": [
        915,
        557,
        1261,
        740
      ],
      "confidence": 0.2,
      "source": "local",
      "flags": [
        "heuristic"
      ]
    },
    {
      "id": "p11_curved_warp-drop-cap",
      "type": "drop_cap",
      "bbox": [
        49,
        557,
        222,
        985
      ],
      "confidence": 0.18,
      "source": "local",
      "flags": [
        "heuristic"
      ]
    },
    {
      "id": "p11_curved_warp-footnote",
      "type": "footnote",
      "bbox": [
        114,
        2640,
        2062,
        3008
      ],
      "confidence": 0.2,
      "source": "local",
      "flags": [
        "heuristic"
      ]
    },
    {
      "id": "p11_curved_warp-marginalia",
      "type": "marginalia",
      "bbox": [
        6,
        771,
        179,
        2303
      ],
      "confidence": 0.18,
      "source": "local",
      "flags": [
        "heuristic"
      ]
    }
  ],
  "metrics": {
    "processingMs": 0,
    "deskewConfidence": 1,
    "shadowScore": -78.683129264504,
    "maskCoverage": 1,
    "backgroundStd": 2.9652577305861993,
    "backgroundMean": 254.0746280121986,
    "illuminationResidual": 0.587484057207485,
    "spineShadowScore": 0,
    "layoutScore": 0.9708320425265452,
    "baseline": {
      "medianSpacingPx": 34.85294117647059,
      "lineStraightnessResidual": 8,
      "confidence": 0.7355301702887045
    }
  },
  "overrides": {}
}
