{
  "version": "1.0.0",
  "pageId": "p10_spread_dark_gutter",
  "source": {
    "path": "/Users/jonathanbotha/GitHub/Asteria-Studio/tests/fixtures/golden_corpus/v1/inputs/p10_spread_dark_gutter.png",
    "checksum": "32dda699dca8a0ce0f306bd75fdd4098c33ea32953c6a479e78878dc15267d6b"
  },
  "dimensions": {
    "width": 184.15,
    "height": 260.35,
    "unit": "mm"
  },
  "dpi": 300,
  "normalization": {
    "cropBox": [
      0,
      0,
      2174,
      3074
    ],
    "pageMask": [
      3,
      7,
      2171,
      3067
    ],
    "dpiSource": "fallback",
    "bleed": 2.9999939999999996,
    "trim": 0,
    "scale": 0.4324915490157089,
    "skewAngle": -16,
    "warp": {
      "method": "affine",
      "residual": 0
    },
    "shadow": {
      "present": false,
      "side": "none",
      "widthPx": 0,
      "confidence": -0.0896656382342343,
      "darkness": -20.900906321068874
    },
    "shading": {
      "method": "border-regression",
      "backgroundModel": "lowpass-field",
      "spineShadowModel": "edge-aware-band",
      "params": {
        "fieldWidth": 96,
        "fieldHeight": 96
      },
      "confidence": 0.018617026618018
    }
  },
  "elements": [
    {
      "id": "p10_spread_dark_gutter-page-bounds",
      "type": "page_bounds",
      "bbox": [
        0,
        0,
        2174,
        3074
      ],
      "confidence": 0.6,
      "source": "local",
      "flags": [
        "derived"
      ]
    },
    {
      "id": "p10_spread_dark_gutter-text-block",
      "type": "text_block",
      "bbox": [
        3,
        7,
        2171,
        3067
      ],
      "confidence": 0.55,
      "source": "local",
      "flags": [
        "mask-derived"
      ]
    },
    {
      "id": "p10_spread_dark_gutter-title",
      "type": "title",
      "bbox": [
        263,
        68,
        1911,
        435
      ],
      "confidence": 0.28,
      "source": "local",
      "flags": [
        "heuristic"
      ]
    },
    {
      "id": "p10_spread_dark_gutter-running-head",
      "type": "running_head",
      "bbox": [
        220,
        7,
        1954,
        252
      ],
      "confidence": 0.25,
      "source": "local",
      "flags": [
        "heuristic"
      ]
    },
    {
      "id": "p10_spread_dark_gutter-folio",
      "type": "folio",
      "bbox": [
        914,
        2761,
        1260,
        3006
      ],
      "confidence": 0.22,
      "source": "local",
      "flags": [
        "heuristic"
      ]
    },
    {
      "id": "p10_spread_dark_gutter-ornament",
      "type": "ornament",
      "bbox": [
        914,
        558,
        1260,
        741
      ],
      "confidence": 0.2,
      "source": "local",
      "flags": [
        "heuristic"
      ]
    },
    {
      "id": "p10_spread_dark_gutter-drop-cap",
      "type": "drop_cap",
      "bbox": [
        46,
        558,
        220,
        986
      ],
      "confidence": 0.18,
      "source": "local",
      "flags": [
        "heuristic"
      ]
    },
    {
      "id": "p10_spread_dark_gutter-footnote",
      "type": "footnote",
      "bbox": [
        111,
        2639,
        2063,
        3006
      ],
      "confidence": 0.2,
      "source": "local",
      "flags": [
        "heuristic"
      ]
    },
    {
      "id": "p10_spread_dark_gutter-marginalia",
      "type": "marginalia",
      "bbox": [
        3,
        772,
        176,
        2302
      ],
      "confidence": 0.18,
      "source": "local",
      "flags": [
        "heuristic"
      ]
    }
  ],
  "metrics": {
    "processingMs": 0,
    "deskewConfidence": 1,
    "shadowScore": -20.900906321068874,
    "maskCoverage": 1,
    "backgroundStd": 3.1742736097016357,
    "backgroundMean": 254.03515049261298,
    "illuminationResidual": 0.619729440537284,
    "spineShadowScore": 0,
    "layoutScore": 0.9707144710945428,
    "baseline": {
      "medianSpacingPx": 22.82967032967033,
      "lineStraightnessResidual": 8,
      "confidence": 0.7203844217101938
    }
  },
  "overrides": {}
}
