{
  "version": "1.0.0",
  "pageId": "p01_clean_single",
  "source": {
    "path": "/Users/jonathanbotha/GitHub/Asteria-Studio/tests/fixtures/golden_corpus/v1/inputs/p01_clean_single.png",
    "checksum": "76d301add1bb83c56a3ef39fa51c85c26b1bac0c98280594f894a9643f3cb054"
  },
  "dimensions": {
    "width": 767.2916666666666,
    "height": 1084.7916666666667,
    "unit": "mm"
  },
  "dpi": 72,
  "normalization": {
    "cropBox": [
      0,
      0,
      2174,
      3074
    ],
    "pageMask": [
      5,
      5,
      2169,
      3070
    ],
    "dpiSource": "metadata",
    "bleed": 12.499975,
    "trim": 0,
    "scale": 0.7402995234853642,
    "skewAngle": -16,
    "warp": {
      "method": "affine",
      "residual": 0
    },
    "shadow": {
      "present": false,
      "side": "none",
      "widthPx": 0,
      "confidence": -0.432169314653267,
      "darkness": -76.75049766985848
    },
    "shading": {
      "method": "border-regression",
      "backgroundModel": "lowpass-field",
      "spineShadowModel": "edge-aware-band",
      "params": {
        "fieldWidth": 96,
        "fieldHeight": 96
      },
      "confidence": 0
    }
  },
  "elements": [
    {
      "id": "p01_clean_single-page-bounds",
      "type": "page_bounds",
      "bbox": [
        0,
        0,
        2174,
        3074
      ],
      "confidence": 0.6,
      "source": "local",
      "flags": [
        "derived"
      ]
    },
    {
      "id": "p01_clean_single-text-block",
      "type": "text_block",
      "bbox": [
        5,
        5,
        2169,
        3070
      ],
      "confidence": 0.55,
      "source": "local",
      "flags": [
        "mask-derived"
      ]
    },
    {
      "id": "p01_clean_single-title",
      "type": "title",
      "bbox": [
        265,
        66,
        1909,
        434
      ],
      "confidence": 0.28,
      "source": "local",
      "flags": [
        "heuristic"
      ]
    },
    {
      "id": "p01_clean_single-running-head",
      "type": "running_head",
      "bbox": [
        221,
        5,
        1953,
        250
      ],
      "confidence": 0.25,
      "source": "local",
      "flags": [
        "heuristic"
      ]
    },
    {
      "id": "p01_clean_single-folio",
      "type": "folio",
      "bbox": [
        914,
        2764,
        1260,
        3009
      ],
      "confidence": 0.22,
      "source": "local",
      "flags": [
        "heuristic"
      ]
    },
    {
      "id": "p01_clean_single-ornament",
      "type": "ornament",
      "bbox": [
        914,
        557,
        1260,
        741
      ],
      "confidence": 0.2,
      "source": "local",
      "flags": [
        "heuristic"
      ]
    },
    {
      "id": "p01_clean_single-drop-cap",
      "type": "drop_cap",
      "bbox": [
        48,
        557,
        221,
        986
      ],
      "confidence": 0.18,
      "source": "local",
      "flags": [
        "heuristic"
      ]
    },
    {
      "id": "p01_clean_single-footnote",
      "type": "footnote",
      "bbox": [
        113,
        2641,
        2061,
        3009
      ],
      "confidence": 0.2,
      "source": "local",
      "flags": [
        "heuristic"
      ]
    },
    {
      "id": "p01_clean_single-marginalia",
      "type": "marginalia",
      "bbox": [
        5,
        771,
        178,
        2304
      ],
      "confidence": 0.18,
      "source": "local",
      "flags": [
        "heuristic"
      ]
    }
  ],
  "metrics": {
    "processingMs": 0,
    "deskewConfidence": 1,
    "shadowScore": -76.75049766985848,
    "maskCoverage": 1,
    "backgroundStd": 2.985592403298865,
    "backgroundMean": 254.06473010239748,
    "illuminationResidual": 0.5881245925816262,
    "spineShadowScore": 0,
    "layoutScore": 0.965670023739691,
    "baseline": {
      "medianSpacingPx": 20.084745762711865,
      "lineStraightnessResidual": 8,
      "confidence": 0.7323357494031599
    }
  },
  "overrides": {}
}
